{"schema_version":"1","analysis_rev":"fx-0001","producer_commit":"w0-fixture","input_artifact_hashes":{},"labels":[{"scene_key":"wh-sdg-fixture-01","t_ms":4600,"actor_refs":[{"scene_key":"wh-sdg-fixture-01","entity_id":"P1","kind":"person"},{"scene_key":"wh-sdg-fixture-01","entity_id":"F1","kind":"forklift"}],"task":"C1","label":"yielding","source":"rule","rule_id":"wh_dodge","annotator":null,"note":null},{"scene_key":"wh-sdg-fixture-01","t_ms":4500,"actor_refs":[{"scene_key":"wh-sdg-fixture-01","entity_id":"F1","kind":"forklift"}],"task":"C2","label":"continue","source":"rule","rule_id":"c2_continue","annotator":null,"note":null},{"scene_key":"wh-sdg-fixture-01","t_ms":4600,"actor_refs":[{"scene_key":"wh-sdg-fixture-01","entity_id":"P1","kind":"person"}],"task":"C4","label":"4.6","source":"rule","rule_id":"c4_dodge_start","annotator":null,"note":"first Dodge frame (s)"}]}
